{
  "schemaVersion": 2,
  "jobId": "geo-destination-destination_argentina_ostrov_martilo",
  "stableId": "destination_argentina_ostrov_martilo",
  "kind": "destination",
  "canonicalPath": "/argentina/place/martillo-island/",
  "sourceFingerprint": "58c4bbd30f32c6c20588d750b03f5814caff73c4d9c031b64b39dfba8babddbd",
  "status": "READY",
  "decisionPolicy": "probability-70-v1",
  "identityScope": "single",
  "entityClass": "Landform",
  "external": {
    "wikidataQid": "Q16579929",
    "geonamesId": "3844784",
    "wikipedia": {
      "es": "https://es.wikipedia.org/wiki/Isla_Martillo"
    }
  },
  "location": {
    "latitude": -54.90716,
    "longitude": -67.38325,
    "pointRole": "representative",
    "coordinateSource": "https://www.geonames.org/3844784/"
  },
  "relationships": [
    {
      "type": "containedInPlace",
      "targetId": "country_argentina"
    }
  ],
  "evidence": [
    {
      "field": "identity",
      "sourceUrl": "https://turismoushuaia.com/actividad/navegacion-a-la-pinguinera/",
      "checkedAt": "2026-10-16T20:36:55.250Z",
      "note": "Isla Martillo/Yecapasela — остров пролива Beagle у Ushuaia с колонией магеллановых и папуанских пингвинов; совпадают MD, GeoNames ISL и официальный муниципальный турпортал. Не маяк Isla Martillo и не наземный национальный парк."
    },
    {
      "field": "identity",
      "sourceUrl": "https://adatours.ru/argentina/place/martillo-island/",
      "checkedAt": "2026-10-16T20:36:55.250Z",
      "note": "Live HTML проверен: HTTP 200, H1, canonical и ID текущих MD/source-index согласованы; noindex отсутствует."
    },
    {
      "field": "external.wikidataQid",
      "sourceUrl": "https://www.wikidata.org/wiki/Q16579929",
      "checkedAt": "2026-10-16T20:36:55.250Z",
      "note": "Isla Martillo/Yecapasela — остров пролива Beagle у Ushuaia с колонией магеллановых и папуанских пингвинов; совпадают MD, GeoNames ISL и официальный муниципальный турпортал. Не маяк Isla Martillo и не наземный национальный парк."
    },
    {
      "field": "external.geonamesId",
      "sourceUrl": "https://www.geonames.org/3844784/",
      "checkedAt": "2026-10-16T20:36:55.250Z",
      "note": "Прочитана текущая первичная карточка GeoNames: точное название, Argentina, тип Island и подходящая административная география."
    },
    {
      "field": "external.wikipedia",
      "sourceUrl": "https://es.wikipedia.org/wiki/Isla_Martillo",
      "checkedAt": "2026-10-16T20:36:55.250Z",
      "note": "Isla Martillo/Yecapasela — остров пролива Beagle у Ushuaia с колонией магеллановых и папуанских пингвинов; совпадают MD, GeoNames ISL и официальный муниципальный турпортал. Не маяк Isla Martillo и не наземный национальный парк."
    },
    {
      "field": "location",
      "sourceUrl": "https://www.geonames.org/3844784/",
      "checkedAt": "2026-10-16T20:36:55.250Z",
      "note": "Выбрана текущая опорная точка острова GeoNames 3844784. Это representative острова, не точка высадки к пингвинам. Испанская статья даёт другой центр 54°54′24.47″S 67°23′14.14″W; не усреднялись."
    },
    {
      "field": "location",
      "sourceUrl": "https://turismoushuaia.com/actividad/navegacion-a-la-pinguinera/",
      "checkedAt": "2026-10-16T20:36:55.250Z",
      "note": "Isla Martillo/Yecapasela — остров пролива Beagle у Ushuaia с колонией магеллановых и папуанских пингвинов; совпадают MD, GeoNames ISL и официальный муниципальный турпортал. Не маяк Isla Martillo и не наземный национальный парк."
    },
    {
      "field": "entityClass",
      "sourceUrl": "https://turismoushuaia.com/actividad/navegacion-a-la-pinguinera/",
      "checkedAt": "2026-10-16T20:36:55.250Z",
      "note": "Isla Martillo/Yecapasela — остров пролива Beagle у Ushuaia с колонией магеллановых и папуанских пингвинов; совпадают MD, GeoNames ISL и официальный муниципальный турпортал. Не маяк Isla Martillo и не наземный национальный парк."
    },
    {
      "field": "relationships.country_argentina",
      "sourceUrl": "https://turismoushuaia.com/actividad/navegacion-a-la-pinguinera/",
      "checkedAt": "2026-10-16T20:36:55.250Z",
      "note": "Подтверждено расположение выбранного объекта в Аргентине."
    }
  ],
  "confidence": "high",
  "assessments": [
    {
      "field": "identity",
      "probability": 99,
      "selected": "Остров Мартильо",
      "reason": "Isla Martillo/Yecapasela — остров пролива Beagle у Ushuaia с колонией магеллановых и папуанских пингвинов; совпадают MD, GeoNames ISL и официальный муниципальный турпортал. Не маяк Isla Martillo и не наземный национальный парк."
    },
    {
      "field": "external.wikidataQid",
      "probability": 99,
      "selected": "Q16579929",
      "reason": "Isla Martillo/Yecapasela — остров пролива Beagle у Ushuaia с колонией магеллановых и папуанских пингвинов; совпадают MD, GeoNames ISL и официальный муниципальный турпортал. Не маяк Isla Martillo и не наземный национальный парк."
    },
    {
      "field": "external.geonamesId",
      "probability": 98,
      "selected": "3844784",
      "reason": "Isla Martillo/Yecapasela — остров пролива Beagle у Ushuaia с колонией магеллановых и папуанских пингвинов; совпадают MD, GeoNames ISL и официальный муниципальный турпортал. Не маяк Isla Martillo и не наземный национальный парк."
    },
    {
      "field": "external.wikipedia",
      "probability": 99,
      "selected": "{\"es\":\"https://es.wikipedia.org/wiki/Isla_Martillo\"}",
      "reason": "Точная статья о выбранном объекте; не страница неоднозначностей и не одноименное поселение/водоем."
    },
    {
      "field": "location",
      "probability": 98,
      "selected": "{\"latitude\":-54.90716,\"longitude\":-67.38325,\"pointRole\":\"representative\",\"coordinateSource\":\"https://www.geonames.org/3844784/\"}",
      "reason": "Выбрана текущая опорная точка острова GeoNames 3844784. Это representative острова, не точка высадки к пингвинам. Испанская статья даёт другой центр 54°54′24.47″S 67°23′14.14″W; не усреднялись."
    },
    {
      "field": "entityClass",
      "probability": 99,
      "selected": "Landform",
      "reason": "Isla Martillo/Yecapasela — остров пролива Beagle у Ushuaia с колонией магеллановых и папуанских пингвинов; совпадают MD, GeoNames ISL и официальный муниципальный турпортал. Не маяк Isla Martillo и не наземный национальный парк."
    },
    {
      "field": "relationships.country_argentina",
      "probability": 99,
      "selected": "country_argentina",
      "reason": "География Argentina подтверждена MD и внешними источниками."
    }
  ],
  "reviewNote": "Выбрана текущая опорная точка острова GeoNames 3844784. Это representative острова, не точка высадки к пингвинам. Испанская статья даёт другой центр 54°54′24.47″S 67°23′14.14″W; не усреднялись."
}
