{
  "schemaVersion": 2,
  "jobId": "geo-destination-destination_colombia_mutanzi",
  "stableId": "destination_colombia_mutanzi",
  "kind": "destination",
  "canonicalPath": "/colombia/place/mutanzhi/",
  "sourceFingerprint": "1986a1aa30b4c03bcb85196cc8dcf5f954df496e07ab799146ad968a5aabd316",
  "status": "READY",
  "confidence": "high",
  "decisionPolicy": "probability-70-v1",
  "identityScope": "single",
  "entityClass": "indigenous village",
  "external": {
    "osm": {
      "type": "node",
      "id": 4797443256
    }
  },
  "relationships": [
    {
      "type": "containedInPlace",
      "targetId": "country_colombia"
    },
    {
      "type": "relatedPlace",
      "targetId": "destination_colombia_zateryannyj_gorod"
    }
  ],
  "evidence": [
    {
      "field": "identity",
      "sourceUrl": "https://adatours.ru/colombia/place/mutanzhi/",
      "checkedAt": "2026-10-17T07:06:07.729Z",
      "note": "Прочитаны текущие MD и source-index на main 989a35d14eab8a816010b3c5c40da68f62d230bb; stable ID/countryId/URL/тип согласованы. Публичный URL HTTP200, canonical совпадает, H1 соответствует, noindex отсутствует. Община когуй Mutanzhi на тропе к Тейуне, вариант названия Mutanyi. INDETUR §4.6 и карта GHF подтверждают самостоятельную деревню между Wiwa Lodge и Múmake. Местный оператор Aventure Colombia использует Mutanyi в заголовке дня и Mutanzhi в описании того же посещения. OSM node4797443256 name=Mutanyi place=village и way110852777 обозначают то же поселение в этом месте маршрута; выбран узел поселения, не bounding-box центр полигона. Точный QID/GeoNames не найден."
    },
    {
      "field": "identity",
      "sourceUrl": "https://indetur.gov.co/wp-content/uploads/2023/09/Inventario-Atractivos-No-Tradicionales-Teyuna.pdf",
      "checkedAt": "2026-10-17T07:06:07.729Z",
      "note": "Внешний источник подтверждает название, географию и фактический объект. Община когуй Mutanzhi на тропе к Тейуне, вариант названия Mutanyi. INDETUR §4.6 и карта GHF подтверждают самостоятельную деревню между Wiwa Lodge и Múmake. Местный оператор Aventure Colombia использует Mutanyi в заголовке дня и Mutanzhi в описании того же посещения. OSM node4797443256 name=Mutanyi place=village и way110852777 обозначают то же поселение в этом месте маршрута; выбран узел поселения, не bounding-box центр полигона. Точный QID/GeoNames не найден."
    },
    {
      "field": "entityClass",
      "sourceUrl": "https://indetur.gov.co/wp-content/uploads/2023/09/Inventario-Atractivos-No-Tradicionales-Teyuna.pdf",
      "checkedAt": "2026-10-17T07:06:07.729Z",
      "note": "Класс по фактическому именованному объекту, а не общей категории destinationType в MD. Община когуй Mutanzhi на тропе к Тейуне, вариант названия Mutanyi. INDETUR §4.6 и карта GHF подтверждают самостоятельную деревню между Wiwa Lodge и Múmake. Местный оператор Aventure Colombia использует Mutanyi в заголовке дня и Mutanzhi в описании того же посещения. OSM node4797443256 name=Mutanyi place=village и way110852777 обозначают то же поселение в этом месте маршрута; выбран узел поселения, не bounding-box центр полигона. Точный QID/GeoNames не найден."
    },
    {
      "field": "relationships.country_colombia",
      "sourceUrl": "https://indetur.gov.co/wp-content/uploads/2023/09/Inventario-Atractivos-No-Tradicionales-Teyuna.pdf",
      "checkedAt": "2026-10-17T07:06:07.729Z",
      "note": "Местоположение в Колумбии подтверждено источником и countryId текущего MD/source-index."
    },
    {
      "field": "external.osm",
      "sourceUrl": "https://www.openstreetmap.org/node/4797443256",
      "checkedAt": "2026-10-17T07:06:07.729Z",
      "note": "Прочитан первичный Overpass OSM: node4797443256 name Mutanyi, place village, координаты11.099865,-73.8792837; рядом совпадающий полигон way110852777."
    },
    {
      "field": "external.osm",
      "sourceUrl": "https://aventurecolombia.com/voyages/trek-cite-perdue/",
      "checkedAt": "2026-10-17T07:06:07.729Z",
      "note": "Первичный маршрут местного оператора: заголовок Mutanyi, описание Mutanzhi на одном и том же дне; расположение сопоставлено с картой GHF."
    },
    {
      "field": "location",
      "sourceUrl": "https://www.openstreetmap.org/node/4797443256",
      "checkedAt": "2026-10-17T07:06:07.729Z",
      "note": "Выбрана одна опубликованная точка с указанной ролью; координаты не усреднялись. Община когуй Mutanzhi на тропе к Тейуне, вариант названия Mutanyi. INDETUR §4.6 и карта GHF подтверждают самостоятельную деревню между Wiwa Lodge и Múmake. Местный оператор Aventure Colombia использует Mutanyi в заголовке дня и Mutanzhi в описании того же посещения. OSM node4797443256 name=Mutanyi place=village и way110852777 обозначают то же поселение в этом месте маршрута; выбран узел поселения, не bounding-box центр полигона. Точный QID/GeoNames не найден."
    },
    {
      "field": "relationships.destination_colombia_zateryannyj_gorod",
      "sourceUrl": "https://indetur.gov.co/wp-content/uploads/2023/09/Inventario-Atractivos-No-Tradicionales-Teyuna.pdf",
      "checkedAt": "2026-10-17T07:06:07.729Z",
      "note": "INDETUR описывает Machete Pelao и Mutanzhi как самостоятельные места пешеходного маршрута к Тейуне (Ciudad Perdida)."
    },
    {
      "field": "identity",
      "sourceUrl": "https://globalheritagefund.org/images/uploads/projects/ghfciudadpPerdidamapcommunitydevelopmentnovember2011_low-res.pdf",
      "checkedAt": "2026-10-17T07:06:07.729Z",
      "note": "Карта Global Heritage Fund2011, масштаб1:70000: отдельная Indigenous Village Mutanzhi между Wiwa Lodge и Múmake Lodge; соответствует положению Mutanyi в OSM."
    }
  ],
  "assessments": [
    {
      "field": "identity",
      "probability": 95,
      "selected": "indigenous village",
      "reason": "Община когуй Mutanzhi на тропе к Тейуне, вариант названия Mutanyi. INDETUR §4.6 и карта GHF подтверждают самостоятельную деревню между Wiwa Lodge и Múmake. Местный оператор Aventure Colombia использует Mutanyi в заголовке дня и Mutanzhi в описании того же посещения. OSM node4797443256 name=Mutanyi place=village и way110852777 обозначают то же поселение в этом месте маршрута; выбран узел поселения, не bounding-box центр полигона. Точный QID/GeoNames не найден."
    },
    {
      "field": "entityClass",
      "probability": 98,
      "selected": "indigenous village",
      "reason": "Община когуй Mutanzhi на тропе к Тейуне, вариант названия Mutanyi. INDETUR §4.6 и карта GHF подтверждают самостоятельную деревню между Wiwa Lodge и Múmake. Местный оператор Aventure Colombia использует Mutanyi в заголовке дня и Mutanzhi в описании того же посещения. OSM node4797443256 name=Mutanyi place=village и way110852777 обозначают то же поселение в этом месте маршрута; выбран узел поселения, не bounding-box центр полигона. Точный QID/GeoNames не найден."
    },
    {
      "field": "relationships.country_colombia",
      "probability": 99,
      "selected": "country_colombia",
      "reason": "Страна объекта совпадает с текущими MD/source-index и внешней географией."
    },
    {
      "field": "external.osm",
      "probability": 93,
      "selected": "{\"type\":\"node\",\"id\":4797443256}",
      "reason": "Община когуй Mutanzhi на тропе к Тейуне, вариант названия Mutanyi. INDETUR §4.6 и карта GHF подтверждают самостоятельную деревню между Wiwa Lodge и Múmake. Местный оператор Aventure Colombia использует Mutanyi в заголовке дня и Mutanzhi в описании того же посещения. OSM node4797443256 name=Mutanyi place=village и way110852777 обозначают то же поселение в этом месте маршрута; выбран узел поселения, не bounding-box центр полигона. Точный QID/GeoNames не найден."
    },
    {
      "field": "location",
      "probability": 93,
      "selected": "11.099865,-73.8792837",
      "reason": "Роль: settlement_center. Община когуй Mutanzhi на тропе к Тейуне, вариант названия Mutanyi. INDETUR §4.6 и карта GHF подтверждают самостоятельную деревню между Wiwa Lodge и Múmake. Местный оператор Aventure Colombia использует Mutanyi в заголовке дня и Mutanzhi в описании того же посещения. OSM node4797443256 name=Mutanyi place=village и way110852777 обозначают то же поселение в этом месте маршрута; выбран узел поселения, не bounding-box центр полигона. Точный QID/GeoNames не найден."
    },
    {
      "field": "relationships.destination_colombia_zateryannyj_gorod",
      "probability": 99,
      "selected": "destination_colombia_zateryannyj_gorod",
      "reason": "Обе деревни — самостоятельные поселения на маршруте; не части археологических руин."
    }
  ],
  "reviewNote": "Община когуй Mutanzhi на тропе к Тейуне, вариант названия Mutanyi. INDETUR §4.6 и карта GHF подтверждают самостоятельную деревню между Wiwa Lodge и Múmake. Местный оператор Aventure Colombia использует Mutanyi в заголовке дня и Mutanzhi в описании того же посещения. OSM node4797443256 name=Mutanyi place=village и way110852777 обозначают то же поселение в этом месте маршрута; выбран узел поселения, не bounding-box центр полигона. Точный QID/GeoNames не найден.",
  "location": {
    "latitude": 11.099865,
    "longitude": -73.8792837,
    "pointRole": "settlement_center",
    "coordinateSource": "https://www.openstreetmap.org/node/4797443256"
  }
}
