{
  "schemaVersion": 2,
  "jobId": "geo-tour-tour_source_amazoniya_kruiz_tukano",
  "stableId": "tour_source_amazoniya_kruiz_tukano",
  "kind": "tour",
  "canonicalPath": "/brazil/tour/amazon-tucano-cruise/",
  "sourceFingerprint": "94a28c0e1f689fb0619b2ea360cc625e347d59e1deca94658db3c0aa34285e72",
  "status": "READY",
  "confidence": "high",
  "identityScope": "single",
  "decisionPolicy": "probability-70-v1",
  "relationships": [
    {
      "type": "visits",
      "targetId": "destination_brazil_amazon",
      "position": 1,
      "day": 1
    },
    {
      "type": "visits",
      "targetId": "destination_brazil_tumbira",
      "position": 2,
      "day": 2
    },
    {
      "type": "visits",
      "targetId": "destination_brazil_reka_aruau",
      "position": 3,
      "day": 3
    },
    {
      "type": "relatedPlace",
      "targetId": "destination_brazil_ekologicheskij_park_zhanauari"
    }
  ],
  "evidence": [
    {
      "field": "identity",
      "sourceUrl": "https://github.com/alexyakovlev79/adatours.ru/blob/4f20cacb378afc4589b1da73a591444c9d33b027/src/content/tours/amazoniya-kruiz-tukano.md",
      "checkedAt": "2026-10-17T10:11:33.557Z",
      "note": "Exact active MD matches saved Git blob SHA 864edfeb6a427d294b396f0a4a09532095c6813a; stable ID, locale and product status checked."
    },
    {
      "field": "canonicalPath",
      "sourceUrl": "https://github.com/alexyakovlev79/adatours.ru/blob/4f20cacb378afc4589b1da73a591444c9d33b027/data/source-index/entries/tour_source_amazoniya_kruiz_tukano.json",
      "checkedAt": "2026-10-17T10:11:33.557Z",
      "note": "Exact source-index entry matches stable ID, contentPath and canonical URL /brazil/tour/amazon-tucano-cruise/."
    },
    {
      "field": "relationships.destination_brazil_amazon",
      "sourceUrl": "https://github.com/alexyakovlev79/adatours.ru/blob/4f20cacb378afc4589b1da73a591444c9d33b027/src/content/tours/amazoniya-kruiz-tukano.md",
      "checkedAt": "2026-10-17T10:11:33.557Z",
      "note": "Confirmed visit from itinerary day 1 places; exact registered Destination destination_brazil_amazon."
    },
    {
      "field": "relationships.destination_brazil_tumbira",
      "sourceUrl": "https://github.com/alexyakovlev79/adatours.ru/blob/4f20cacb378afc4589b1da73a591444c9d33b027/src/content/tours/amazoniya-kruiz-tukano.md",
      "checkedAt": "2026-10-17T10:11:33.557Z",
      "note": "Confirmed visit from itinerary day 2 places; exact registered Destination destination_brazil_tumbira."
    },
    {
      "field": "relationships.destination_brazil_reka_aruau",
      "sourceUrl": "https://github.com/alexyakovlev79/adatours.ru/blob/4f20cacb378afc4589b1da73a591444c9d33b027/src/content/tours/amazoniya-kruiz-tukano.md",
      "checkedAt": "2026-10-17T10:11:33.557Z",
      "note": "Confirmed visit from itinerary day 3 places; exact registered Destination destination_brazil_reka_aruau."
    },
    {
      "field": "relationships.destination_brazil_ekologicheskij_park_zhanauari",
      "sourceUrl": "https://github.com/alexyakovlev79/adatours.ru/blob/4f20cacb378afc4589b1da73a591444c9d33b027/src/content/tours/amazoniya-kruiz-tukano.md",
      "checkedAt": "2026-10-17T10:11:33.557Z",
      "note": "Registered Destination is explicitly linked in active MD; visit order and mandatory status not inferred."
    }
  ],
  "assessments": [
    {
      "field": "identity",
      "probability": 99,
      "selected": "tour_source_amazoniya_kruiz_tukano",
      "reason": "Active production MD identity confirmed against canonical source-index and immutable Git blob."
    },
    {
      "field": "relationships.destination_brazil_amazon",
      "probability": 96,
      "selected": "destination_brazil_amazon",
      "reason": "Exact place matched to canonical ID in explicit itinerary/route or primary excursion destination."
    },
    {
      "field": "relationships.destination_brazil_tumbira",
      "probability": 96,
      "selected": "destination_brazil_tumbira",
      "reason": "Exact place matched to canonical ID in explicit itinerary/route or primary excursion destination."
    },
    {
      "field": "relationships.destination_brazil_reka_aruau",
      "probability": 96,
      "selected": "destination_brazil_reka_aruau",
      "reason": "Exact place matched to canonical ID in explicit itinerary/route or primary excursion destination."
    },
    {
      "field": "relationships.destination_brazil_ekologicheskij_park_zhanauari",
      "probability": 90,
      "selected": "destination_brazil_ekologicheskij_park_zhanauari",
      "reason": "Explicit canonical Destination reference; only non-positional relatedPlace asserted."
    }
  ],
  "reviewNote": null
}
