{
  "schemaVersion": 2,
  "jobId": "geo-destination-destination_argentina_purmamarka",
  "stableId": "destination_argentina_purmamarka",
  "kind": "destination",
  "canonicalPath": "/argentina/place/purmamarca/",
  "sourceFingerprint": "6ab38ed57d206785339d00e26456ccd2ce198a1cba03962e1dfd6dc0b8ff19cf",
  "status": "READY",
  "decisionPolicy": "probability-70-v1",
  "identityScope": "composite",
  "entityClass": "Place",
  "external": {
    "wikidataQid": "Q1025405",
    "geonamesId": "3839841",
    "wikipedia": {
      "en": "https://en.wikipedia.org/wiki/Purmamarca"
    }
  },
  "location": {
    "latitude": -23.74595,
    "longitude": -65.49976,
    "pointRole": "settlement_center",
    "coordinateSource": "https://www.geonames.org/3839841/"
  },
  "relationships": [
    {
      "type": "containedInPlace",
      "targetId": "country_argentina"
    }
  ],
  "evidence": [
    {
      "field": "identity",
      "sourceUrl": "https://www.argentina.travel/actividades/purmamarca",
      "checkedAt": "2026-10-16T20:36:55.250Z",
      "note": "Основной именованный референт — поселение Purmamarca в Jujuy/Tumbaya с улицами, рынком и площадью. Cerro de los Siete Colores и Paseo de los Colorados являются его окрестностями, не всей сущностью страницы. Классификация natural_area в MD не превращает поселение в гору."
    },
    {
      "field": "identity",
      "sourceUrl": "https://adatours.ru/argentina/place/purmamarca/",
      "checkedAt": "2026-10-16T20:36:55.250Z",
      "note": "Live HTML проверен: HTTP 200, H1, canonical и ID текущих MD/source-index согласованы; noindex отсутствует."
    },
    {
      "field": "external.wikidataQid",
      "sourceUrl": "https://www.wikidata.org/wiki/Q1025405",
      "checkedAt": "2026-10-16T20:36:55.250Z",
      "note": "Основной именованный референт — поселение Purmamarca в Jujuy/Tumbaya с улицами, рынком и площадью. Cerro de los Siete Colores и Paseo de los Colorados являются его окрестностями, не всей сущностью страницы. Классификация natural_area в MD не превращает поселение в гору."
    },
    {
      "field": "external.geonamesId",
      "sourceUrl": "https://www.geonames.org/3839841/",
      "checkedAt": "2026-10-16T20:36:55.250Z",
      "note": "Прочитана текущая первичная карточка GeoNames: точное название, Argentina, тип Populated place и подходящая административная география."
    },
    {
      "field": "external.wikipedia",
      "sourceUrl": "https://en.wikipedia.org/wiki/Purmamarca",
      "checkedAt": "2026-10-16T20:36:55.250Z",
      "note": "Основной именованный референт — поселение Purmamarca в Jujuy/Tumbaya с улицами, рынком и площадью. Cerro de los Siete Colores и Paseo de los Colorados являются его окрестностями, не всей сущностью страницы. Классификация natural_area в MD не превращает поселение в гору."
    },
    {
      "field": "location",
      "sourceUrl": "https://www.geonames.org/3839841/",
      "checkedAt": "2026-10-16T20:36:55.250Z",
      "note": "Точная PPL-точка GeoNames 3839841 −23.74595,−65.49976 выбрана для поселения. Грубая минутная P625 −23.733333,−65.483333 сдвинута примерно на 2 км на северо-восток; не усреднена. География и вид объекта независимо сверены с национальным туристическим порталом."
    },
    {
      "field": "location",
      "sourceUrl": "https://www.argentina.travel/actividades/purmamarca",
      "checkedAt": "2026-10-16T20:36:55.250Z",
      "note": "Основной именованный референт — поселение Purmamarca в Jujuy/Tumbaya с улицами, рынком и площадью. Cerro de los Siete Colores и Paseo de los Colorados являются его окрестностями, не всей сущностью страницы. Классификация natural_area в MD не превращает поселение в гору."
    },
    {
      "field": "entityClass",
      "sourceUrl": "https://www.argentina.travel/actividades/purmamarca",
      "checkedAt": "2026-10-16T20:36:55.250Z",
      "note": "Основной именованный референт — поселение Purmamarca в Jujuy/Tumbaya с улицами, рынком и площадью. Cerro de los Siete Colores и Paseo de los Colorados являются его окрестностями, не всей сущностью страницы. Классификация natural_area в MD не превращает поселение в гору."
    },
    {
      "field": "relationships.country_argentina",
      "sourceUrl": "https://www.argentina.travel/actividades/purmamarca",
      "checkedAt": "2026-10-16T20:36:55.250Z",
      "note": "Подтверждено расположение выбранного объекта в Аргентине."
    }
  ],
  "confidence": "high",
  "assessments": [
    {
      "field": "identity",
      "probability": 99,
      "selected": "Пурмамарка",
      "reason": "Основной именованный референт — поселение Purmamarca в Jujuy/Tumbaya с улицами, рынком и площадью. Cerro de los Siete Colores и Paseo de los Colorados являются его окрестностями, не всей сущностью страницы. Классификация natural_area в MD не превращает поселение в гору."
    },
    {
      "field": "external.wikidataQid",
      "probability": 99,
      "selected": "Q1025405",
      "reason": "Основной именованный референт — поселение Purmamarca в Jujuy/Tumbaya с улицами, рынком и площадью. Cerro de los Siete Colores и Paseo de los Colorados являются его окрестностями, не всей сущностью страницы. Классификация natural_area в MD не превращает поселение в гору."
    },
    {
      "field": "external.geonamesId",
      "probability": 98,
      "selected": "3839841",
      "reason": "Основной именованный референт — поселение Purmamarca в Jujuy/Tumbaya с улицами, рынком и площадью. Cerro de los Siete Colores и Paseo de los Colorados являются его окрестностями, не всей сущностью страницы. Классификация natural_area в MD не превращает поселение в гору."
    },
    {
      "field": "external.wikipedia",
      "probability": 99,
      "selected": "{\"en\":\"https://en.wikipedia.org/wiki/Purmamarca\"}",
      "reason": "Точная статья о выбранном объекте; не страница неоднозначностей и не одноименное поселение/водоем."
    },
    {
      "field": "location",
      "probability": 98,
      "selected": "{\"latitude\":-23.74595,\"longitude\":-65.49976,\"pointRole\":\"settlement_center\",\"coordinateSource\":\"https://www.geonames.org/3839841/\"}",
      "reason": "Точная PPL-точка GeoNames 3839841 −23.74595,−65.49976 выбрана для поселения. Грубая минутная P625 −23.733333,−65.483333 сдвинута примерно на 2 км на северо-восток; не усреднена. География и вид объекта независимо сверены с национальным туристическим порталом."
    },
    {
      "field": "entityClass",
      "probability": 99,
      "selected": "Place",
      "reason": "Основной именованный референт — поселение Purmamarca в Jujuy/Tumbaya с улицами, рынком и площадью. Cerro de los Siete Colores и Paseo de los Colorados являются его окрестностями, не всей сущностью страницы. Классификация natural_area в MD не превращает поселение в гору."
    },
    {
      "field": "relationships.country_argentina",
      "probability": 99,
      "selected": "country_argentina",
      "reason": "География Argentina подтверждена MD и внешними источниками."
    }
  ],
  "reviewNote": "Точная PPL-точка GeoNames 3839841 −23.74595,−65.49976 выбрана для поселения. Грубая минутная P625 −23.733333,−65.483333 сдвинута примерно на 2 км на северо-восток; не усреднена. География и вид объекта независимо сверены с национальным туристическим порталом."
}
