{
  "schemaVersion": 2,
  "jobId": "geo-destination-destination_el_salvador_hojya_de_seren",
  "stableId": "destination_el_salvador_hojya_de_seren",
  "kind": "destination",
  "canonicalPath": "/el-salvador/place/joya-de-ceren/",
  "sourceFingerprint": "38b723f409e94892d3be484f4e7a9a5a1098d3ef1823b583ed6bb8fbed53618c",
  "status": "READY",
  "decisionPolicy": "probability-70-v1",
  "identityScope": "single",
  "external": {
    "unescoSiteIds": [
      "675"
    ],
    "wikidataQid": "Q27985",
    "wikipedia": {
      "en": "https://en.wikipedia.org/wiki/Joya_de_Cer%C3%A9n"
    }
  },
  "location": {
    "latitude": 13.8275,
    "longitude": -89.3691667,
    "pointRole": "feature_point",
    "coordinateSource": "https://whc.unesco.org/en/list/675/"
  },
  "relationships": [
    {
      "type": "containedInPlace",
      "targetId": "country_el_salvador"
    }
  ],
  "evidence": [
    {
      "field": "identity",
      "sourceUrl": "https://whc.unesco.org/en/list/675/",
      "checkedAt": "2026-10-17T08:35:11.175Z",
      "note": "Joya de Cerén — археологическое поселение в El Salvador, погребённое вулканическим пеплом, объект UNESCO 675; не совремённое поселение и не соседний San Andrés."
    },
    {
      "field": "identity",
      "sourceUrl": "https://github.com/alexyakovlev79/adatours.ru/blob/21732a36d01647f995571a3f042190de339345ef/src/content/destinations/joya-de-ceren.md",
      "checkedAt": "2026-10-17T08:35:11.175Z",
      "note": "Точный действующий MD, stable ID, страна и смысл страницы сверены с задачей; SHA совпадает."
    },
    {
      "field": "identity",
      "sourceUrl": "https://adatours.ru/el-salvador/place/joya-de-ceren/",
      "checkedAt": "2026-10-17T08:35:11.175Z",
      "note": "Публичный URL вернул HTTP 200; canonical совпадает с URL задачи."
    },
    {
      "field": "external.unescoSiteIds",
      "sourceUrl": "https://whc.unesco.org/en/list/675/",
      "checkedAt": "2026-10-17T08:35:11.175Z",
      "note": "Joya de Cerén — археологическое поселение в El Salvador, погребённое вулканическим пеплом, объект UNESCO 675; не совремённое поселение и не соседний San Andrés."
    },
    {
      "field": "external.wikidataQid",
      "sourceUrl": "https://www.wikidata.org/wiki/Q27985",
      "checkedAt": "2026-10-17T08:35:11.175Z",
      "note": "Joya de Cerén — археологическое поселение в El Salvador, погребённое вулканическим пеплом, объект UNESCO 675; не совремённое поселение и не соседний San Andrés."
    },
    {
      "field": "external.wikipedia",
      "sourceUrl": "https://en.wikipedia.org/wiki/Joya_de_Cer%C3%A9n",
      "checkedAt": "2026-10-17T08:35:11.175Z",
      "note": "Joya de Cerén — археологическое поселение в El Salvador, погребённое вулканическим пеплом, объект UNESCO 675; не совремённое поселение и не соседний San Andrés."
    },
    {
      "field": "location",
      "sourceUrl": "https://whc.unesco.org/en/list/675/",
      "checkedAt": "2026-10-17T08:35:11.175Z",
      "note": "UNESCO для участка 675 указывает N13 49 39 W89 22 9; выбрана репрезентативная точка археологического объекта из первичного источника, без усреднения с Wikipedia."
    },
    {
      "field": "relationships.country_el_salvador",
      "sourceUrl": "https://whc.unesco.org/en/list/675/",
      "checkedAt": "2026-10-17T08:35:11.175Z",
      "note": "Joya de Cerén — археологическое поселение в El Salvador, погребённое вулканическим пеплом, объект UNESCO 675; не совремённое поселение и не соседний San Andrés. Страна подтверждена источником и исходным MD."
    }
  ],
  "assessments": [
    {
      "field": "identity",
      "probability": 98,
      "selected": "Хойя-де-Серен",
      "reason": "Joya de Cerén — археологическое поселение в El Salvador, погребённое вулканическим пеплом, объект UNESCO 675; не совремённое поселение и не соседний San Andrés."
    },
    {
      "field": "external.unescoSiteIds",
      "probability": 98,
      "selected": "675",
      "reason": "Joya de Cerén — археологическое поселение в El Salvador, погребённое вулканическим пеплом, объект UNESCO 675; не совремённое поселение и не соседний San Andrés."
    },
    {
      "field": "external.wikidataQid",
      "probability": 97,
      "selected": "Q27985",
      "reason": "Joya de Cerén — археологическое поселение в El Salvador, погребённое вулканическим пеплом, объект UNESCO 675; не совремённое поселение и не соседний San Andrés."
    },
    {
      "field": "external.wikipedia",
      "probability": 98,
      "selected": "https://en.wikipedia.org/wiki/Joya_de_Cer%C3%A9n",
      "reason": "Joya de Cerén — археологическое поселение в El Salvador, погребённое вулканическим пеплом, объект UNESCO 675; не совремённое поселение и не соседний San Andrés."
    },
    {
      "field": "location",
      "probability": 95,
      "selected": "13.8275,-89.3691667",
      "reason": "UNESCO для участка 675 указывает N13 49 39 W89 22 9; выбрана репрезентативная точка археологического объекта из первичного источника, без усреднения с Wikipedia."
    },
    {
      "field": "relationships.country_el_salvador",
      "probability": 98,
      "selected": "country_el_salvador",
      "reason": "Joya de Cerén — археологическое поселение в El Salvador, погребённое вулканическим пеплом, объект UNESCO 675; не совремённое поселение и не соседний San Andrés. Страна подтверждена источником и исходным MD."
    }
  ],
  "confidence": "high",
  "reviewNote": null
}
